{
  "$comment": "HiveMind contract SessionSummary v2.0.0; generated from packages/schema, do not edit",
  "$id": "SessionSummary.schema.json",
  "$schema": "https://json-schema.org/draft/2020-12/schema",
  "additionalProperties": false,
  "description": "Lab session summary",
  "properties": {
    "archetype": {
      "maxLength": 96,
      "minLength": 3,
      "pattern": "^[a-z0-9_]+(?:\\.[a-z0-9_]+)+$",
      "type": "string"
    },
    "archetype_version": {
      "description": "Semantic version major.minor.patch",
      "pattern": "^(0|[1-9]\\d*)\\.(0|[1-9]\\d*)\\.(0|[1-9]\\d*)$",
      "type": "string"
    },
    "created_at": {
      "description": "UTC instant in ISO-8601 with a trailing Z",
      "pattern": "^\\d{4}-\\d{2}-\\d{2}T\\d{2}:\\d{2}:\\d{2}(?:\\.\\d{1,6})?Z$",
      "type": "string"
    },
    "expires_at": {
      "anyOf": [
        {
          "description": "UTC instant in ISO-8601 with a trailing Z",
          "pattern": "^\\d{4}-\\d{2}-\\d{2}T\\d{2}:\\d{2}:\\d{2}(?:\\.\\d{1,6})?Z$",
          "type": "string"
        },
        {
          "type": "null"
        }
      ]
    },
    "hard_ttl_at": {
      "anyOf": [
        {
          "description": "UTC instant in ISO-8601 with a trailing Z",
          "pattern": "^\\d{4}-\\d{2}-\\d{2}T\\d{2}:\\d{2}:\\d{2}(?:\\.\\d{1,6})?Z$",
          "type": "string"
        },
        {
          "type": "null"
        }
      ]
    },
    "id": {
      "pattern": "^HM-LAB-\\d{6}$",
      "type": "string"
    },
    "learner_id": {
      "pattern": "^HM-LRN-\\d{6}$",
      "type": "string"
    },
    "nodes": {
      "items": {
        "additionalProperties": false,
        "properties": {
          "address": {
            "minLength": 1,
            "type": "string"
          },
          "name": {
            "maxLength": 128,
            "minLength": 1,
            "pattern": "^[a-z0-9][a-z0-9._-]*$",
            "type": "string"
          },
          "role": {
            "enum": [
              "host",
              "router",
              "switch",
              "server",
              "client",
              "runner"
            ],
            "type": "string"
          }
        },
        "required": [
          "name",
          "role"
        ],
        "type": "object"
      },
      "type": "array"
    },
    "parameters": {
      "additionalProperties": {},
      "propertyNames": {
        "type": "string"
      },
      "type": "object"
    },
    "provider_class": {
      "anyOf": [
        {
          "$ref": "ExecutionClass.schema.json"
        },
        {
          "type": "null"
        }
      ]
    },
    "provider_id": {
      "anyOf": [
        {
          "maxLength": 128,
          "minLength": 1,
          "pattern": "^[a-z0-9][a-z0-9._-]*$",
          "type": "string"
        },
        {
          "type": "null"
        }
      ]
    },
    "reason": {
      "anyOf": [
        {
          "maxLength": 500,
          "type": "string"
        },
        {
          "type": "null"
        }
      ]
    },
    "recording_key": {
      "anyOf": [
        {
          "minLength": 1,
          "type": "string"
        },
        {
          "type": "null"
        }
      ]
    },
    "requires": {
      "items": {
        "$ref": "Capability.schema.json"
      },
      "minItems": 1,
      "type": "array"
    },
    "revision": {
      "maximum": 9007199254740991,
      "minimum": 0,
      "type": "integer"
    },
    "seed": {
      "maximum": 9007199254740991,
      "minimum": 0,
      "type": "integer"
    },
    "status": {
      "$ref": "LabStatus.schema.json"
    },
    "updated_at": {
      "description": "UTC instant in ISO-8601 with a trailing Z",
      "pattern": "^\\d{4}-\\d{2}-\\d{2}T\\d{2}:\\d{2}:\\d{2}(?:\\.\\d{1,6})?Z$",
      "type": "string"
    },
    "worker_id": {
      "anyOf": [
        {
          "maxLength": 120,
          "minLength": 1,
          "type": "string"
        },
        {
          "type": "null"
        }
      ]
    }
  },
  "required": [
    "id",
    "learner_id",
    "status",
    "archetype",
    "archetype_version",
    "seed",
    "parameters",
    "requires",
    "provider_id",
    "provider_class",
    "worker_id",
    "nodes",
    "revision",
    "created_at",
    "updated_at",
    "expires_at",
    "hard_ttl_at",
    "reason",
    "recording_key"
  ],
  "title": "SessionSummary",
  "type": "object"
}
