{
  "archetype": "linux.single",
  "archetype_version": "1.0.0",
  "created_at": "2026-09-09T12:00:00Z",
  "expires_at": "2026-09-09T14:00:00Z",
  "hard_ttl_at": "2026-09-09T13:00:00Z",
  "id": "HM-LAB-829143",
  "learner_id": "HM-LRN-000001",
  "nodes": [
    {
      "address": "172.29.0.2",
      "name": "host1",
      "role": "host"
    }
  ],
  "parameters": {},
  "provider_class": "C",
  "provider_id": "ubuntu-lab-worker-1",
  "reason": null,
  "recording_key": null,
  "requires": [
    "shell.linux"
  ],
  "revision": 3,
  "seed": 1,
  "status": "ready",
  "updated_at": "2026-09-09T12:00:00Z",
  "worker_id": "ubuntu-lab-worker-1"
}
